,URL,Creation Time,Title,Content
218,https://www.opendiary.com/m/kermitallica/origonal-5478391/,2019-06-26,origonal,"
this grass is the pillow
for my weary head.
the night sky my blanket
the cold earth my bed
if you should remember a damn thing i said
please do not forget me
ive given you promise
ive given you lies
ive given you laughter
and wiped tears from your eyes
if ever you wake to realize
please dont forget me
i’ll walk through the valley alone if i must
i’ll walk till the green grass has turned into dusk
i’ll walk on forever because i know i must
but please do not forget me
i never meant to have more than i should
i always tried the best that i could
and if you should let me i surly would
but please do not forget me
i’ll walk through the valley alone if i must
i’ll walk till the green grass has turned into dusk
i’ll walk on forever because i know i must
ive given you promise
ive given you lies
ive given you laughter
and wiped tears from your eyes
if ever you wake to realize
"
219,https://www.opendiary.com/m/kermitallica/sorry-seems-to-be-the-hardest-word-11-5478555/,2019-06-27,sorry seems to be the hardest word,"
i am not going to lie…
i am as conservative as they come..
but its okay grown ups are supposed to be intelligent…
this is have said to her for 3 decades and it never stuck…
i want to feel bad for her…
i want to feel something that does not involve hatred for the things she has done…
i do love her, i just loathe her life entirely…
i can understand how liberals think the way they do, i’ve experienced it for 32 years…
i know they want to believe hat we are starving children, keeping them in cages and picking on foreign countries…
she would accuse me of being a tyrant by asking, demanding that she stay faithful to me…
to stop crawling out of everyones bed…
its easy to see how the democrats and commies in congress can spread fear and intolerance in the name of love…
she would tell me things when her back was to the wall that were total lies to get me to sway to her side of the fence…
one thing is certain, those who follow the doctrine of lies will be the ones who are hurt the most…
i did it for 3 decades before i wised up…
"
220,https://www.opendiary.com/m/kermitallica/good-day-sunshine-61-5478871/,2019-06-28,good day sunshine,"
its been very hot in indiana…
i work 2nd shift…
hottest part of the day means that the plant is 101 degrees…
if not for my work ethic i would leave this place for something more air conditioned…
i am the oldest person there…
12 years older than my boss…
they all make me feel like i’m 20 years younger…
the heat does not seem to as much…
the place gives me 8 hours to put the world aside and be something productive…
perhaps i am not so obsolete…
"
221,https://www.opendiary.com/m/kermitallica/everybodys-working-for-the-weekend-23-5479049/,2019-06-29,everybodys working for the weekend,"
work week is in the bag…
tired sore and a little chaffed…
still hot…
still tired…
still hanging on…
not sure why…
"
222,https://www.opendiary.com/m/kermitallica/love-shack-10-5479169/,2019-06-29,love shack,"
lord my neighbors are noisy…
cant really drown them out either…
its like a freaking circus on the other side of my wall…
 
"
223,https://www.opendiary.com/m/kermitallica/tuesday-afternoon-48-5479325/,2019-06-30,tuesday afternoon,"
there is nothing more boring than a hot sunday afternoon…
cant really take a nap because of my work schedule…
tire of you tube…
euchre anyone?
"
224,https://www.opendiary.com/m/kermitallica/my-boy-64-5479407/,2019-07-01,my boy,"
its been five months ago today that Jasper left me…
i want to call in and stay in bed all day…
cant…
this hole in my chest will never heal…
"
225,https://www.opendiary.com/m/kermitallica/all-by-myself-106-5479522/,2019-07-02,all by myself,"
i want to sleep…
today is a bad day for trying to sleep…
so i put in two hours of overtime an an hour of the Tick…
5 cigarettes later still not sleepy…
i know why and its not a good reason…
i am “in need” of a companion…
nothing “circus” like, like the neighbors…
just get by with a little help from a friend…
"
226,https://www.opendiary.com/m/kermitallica/the-heat-is-on-40-5479554/,2019-07-02,the heat is on,"
heat advisory in effect until 8:00 pm…
i work from 3 to 3…
heat index of 101…
should be 115 in the plant…
this is gonna be a sucky ass day…
 
"
227,https://www.opendiary.com/m/kermitallica/jump-66-5481151/,2019-07-03,jump,"
it was bad at work…
it has been worse…
the heat brings out the selfish child in everyone…
3.5 hours of overtime…
gonna take a nap…
its been a very short week…
"
228,https://www.opendiary.com/m/kermitallica/jump-jive-and-wail-5481225/,2019-07-04,jump jive and wail,"
being diabetic i have the condition known as restless leg syndrome…
tonight i have restless leg syndrome… all over…
cant set still, twitch twitch twitch like a bowl full of jello…
but thats nothing…
the scariest thing in the world is “do not touch” in brail…
"
229,https://www.opendiary.com/m/kermitallica/people-get-ready-5-5481291/,2019-07-04,people get ready,"
its been ten years of setting in my living room hunkering down with Jasper on the couch, under his blanket and waiting out the fireworks…
his blanket has lost his smell…
its awful big as well….
"
230,https://www.opendiary.com/m/kermitallica/famous-final-scene-3-5481572/,2019-07-06,famous final scene,"
the announcement came across every form of communication known to man and three known to dogs…
the Armada had arrived…
They had come across the blanket of stars to challenge earths greatest heroin combat for the supremacy of earth…
Earth had been given five days to summon their greatest warrior. On the eve of battle our hero stood proud in the morning light waiting for his moment to shine. For his chance to prove himself in mortal combat, that he was worthy of the title…
the ship carrying the invaders champion glistened in the light of dawn as it dropped out of orbit and sped on its way to the location of the fight, it cargo the most massive and horrible champion calm and serine…
its eight engorged arms hung limp, almost as if he creature were napping, hung at its side as the lidless eyes gazed into nowhere…
the ship itself came to hover in front of earths champion. a slow and dull realization came into focus…
humans were giants…
they were towering behemoths that made the alien ship look as if it were a fly…
and as they hovered there in awe of the spectacle of seeing their first human it waved its gigantic hand and swatted them out of existence…
the aliens had lost the fight before it had begun…
the challenge had been answered…
and humanity was saved before their hero could even begin to comprehend what had even happened…
"
231,https://www.opendiary.com/m/kermitallica/goodbye-yellow-brick-road-14-5482437/,2019-07-08,goodbye yellow brick road,"
I may have cancer…
It might be bad…
It might be prostate, colon or pancreatic…
too soon to tell just yet…
I’ll know more in a few days…
"
232,https://www.opendiary.com/m/kermitallica/its-cancer-7-5482477/,2019-07-08,its cancer,"
its not pancreatic…
colon…
 
"
233,https://www.opendiary.com/m/kermitallica/doom-despair-and-agony-on-me-2-5482565/,2019-07-09,doom despair and agony on me,"
to make matters even worse…
i stepped on a nail at work tonight…
tetnis (?) shot…
had to buy my own lolly pop…
stupid doctors…
"
234,https://www.opendiary.com/m/kermitallica/blood-and-roses-5482716/,2019-07-10,blood and roses,"
today was blood work…
send in the flabotinists… or what ever they are called…
one of them said i was a quart low…
my response was, you’re holding it in your hand…
it took me a very long time to get used to my insulin needle…
this is much worse…
made it to work on time to be charming, witty and hard working…
now i set at home like a defrocked porcupine aching from every new hole in my body…
Bo and i are enjoying bbq tater chips an carmel marble cheesecake…
i did take a moment to ponder my own death…
nothing depressing, well nothing any more depressing than usual, WEELLLL, okay maybe a soupçon more…
colon caner is not as deadly as setting too close to the TV cancer, everything should COME OUT okay…
my only wish is that my Jasper was here…
he would know what to say to make everything better…
OH almost forgot, next thursday they want to do a colonoscopy…
at the risk of sounding crass, it’ll be the first time in 6 years someone will tell me to bend over and i actually will be violated…
take that you unreasonably horrible wife of mine!
 
"
235,https://www.opendiary.com/m/kermitallica/sixteen-tons-4-5482802/,2019-07-11,sixteen tons,"
my work day was perfectly horrible…
pick a thing that could go wrong and it did…
i need a good lawyer to get me out of this Murphy’s Law and Order thing…
thanks to the medical maelstrom i’ll be missing my very first day at work since i got the job…
i wonder if there will be punch and pie…
i am sore though…
i hurt almost everywhere…
and i am always tired…
cant wait for this to be over so i can sleep…
i am kinda looking forward to all the woodstock quality pharmaceuticals in my future…
if i put on my brave face would anyone be the wiser?…
"
236,https://www.opendiary.com/m/kermitallica/my-heart-126-5482815/,2019-07-11,my heart,"
WE could set in a stadium listening to the music and the chaos and the overwhelming tenor of the throng.
i would look into her eyes and everything would be gone.
her and i alone in an ocean of faces.
We could set in a restaurant surrounded by people and i would be aware of every eye in the place.
i would lean in to kiss her and everyone would be gone.
her and i alone in our own little garden.
its alright to love alone.
all the things that a house a home.
and when i feel so all alone…
i close my eyes and she is with me.
time has passed like a river in the world and i can no longer see the shore.
i look to walls that bore her image and now everything is gone
i set at night alone.
is alright to love alone
all the things that make a house a home.
and when the sun is sinking low,
i still have have a place for my love to go…
"
237,https://www.opendiary.com/m/kermitallica/round-and-round-65-5483592/,2019-07-13,round and round,"
so today was PROBING DAY…
not so exciting as it sounds…
unless youre into that sort of thing…
in 2 weeks their going to knock me out, run a scope right up main street and take out the bad stuff…
third invasion of my no no places in a month…
safe to say i dont get the whole gay man thing…
"
238,https://www.opendiary.com/m/kermitallica/teo-torriatte-2-5483735/,2019-07-14,teo torriatte,"
today has been a bad day…
smoked my cigarettes till i was sick…
ate everything in the house…
Drank up all my liquids till there was no more…
spent money on things and toys…
nothing can fill the need i have for my son…
i drove past my old house to check and see if he was out playing in the yard or just waiting for me to come and get him…
my heart breaks more and more each day…
i love him and miss more today than i have ever loved or missed him before…
i would give whats left of my life to have him here with me for just one day…
"
239,https://www.opendiary.com/m/kermitallica/chemo-11-5483915/,2019-07-15,chemo,"
the prep for the surgery is murder…
they did a contrast mri…
they did 2 rounds of chemo in hopes of shrinking the tumor…
so far i have had 2 teeth fall out of my head…
this has made them think twice about prep…
the downside is i do not have dental insurance, will in a year…
i am always tired…
i have to wonder if this is worse than they are telling me or if my age does not allow me to bounce back like i should…
and i am always tired…
my bad day is over with…
it seems as though i have issues with containing my grief from time to time…
if i bore you i am sorry…
work is like 16 hours away and i am so not ready for another 115 degree day in the plant…
i want to take a day off, but i do not want to spend a point for it…
besides, i am getting to be the best there is at what i do again…
"
240,https://www.opendiary.com/m/kermitallica/the-heat-is-on-41-5484569/,2019-07-16,the heat is on,"
97 degrees with heat index of 102…
how hot in your neck of the woods?
work was a total bummer cause of the heat…
showered, shaved and the rest of the adage…
time to dream of better things…
"
241,https://www.opendiary.com/m/kermitallica/landslide-48-5486091/,2019-07-16,landslide,"
damnedest thing…
i was setting here writing a small story when i realized that i was crying…
i had found a picture of my Jasper i had not seen in a while…
it made me smile…
on the outside it would seem…
"
242,https://www.opendiary.com/m/kermitallica/blue-eyes-crying-in-the-rain-2-5486165/,2019-07-17,blue eyes crying in the rain,"
well their not blue…
and its not raining…
unless you count all the perspiration…
overtime tonight did not help the heat distress…
but the house is a balmy 63 degrees so sleeping should be a snap…
going to be even hotter on Wednesday…
oh it is wednesday…
dang it…
"
243,https://www.opendiary.com/m/kermitallica/one-day-at-a-time-sweet-jesus-5486336/,2019-07-18,one day at a time sweet jesus,"
have you noticed that you cant say the word jesus without sounding angry?
its a full moon on the hottest days of the year so far…
the idiots will be out in force shooting up the place…
their calling for heat index of 120 to 125 for thursday and friday…
means it will be much hotter in the plant…
Danger hot…
Christ on his stick i wish i had personal time…
"
244,https://www.opendiary.com/m/kermitallica/only-god-knows-why-19-5486791/,2019-07-19,only god knows why,"
i had a discussion about the moon landing with an old friend…
he believes it to be a lie and the earth is flat…
i dont offer this up often but i am  deist minister…
as a point of discussion i ask this question:
When Cain was kicked out of the garden and he went forth, even though he was the first… to found the city of Nod…
Who populated it?
"
245,https://www.opendiary.com/m/kermitallica/its-a-heart-ache-5487874/,2019-07-22,its a heart ache,"
i am used to the idea that i will never get past the death of my son…
but the triggers are like juggling hand grenades thru a mine field…
"
246,https://www.opendiary.com/m/kermitallica/monster-mash-9-5487985/,2019-07-23,monster mash,"
part of my general psychosis is setting here in my writing room, bent over my writing machine in the light of a dim led bulb and watching as tings pass across the picture of my Jasper, that is setting on a shelf six foot above the floor…
little dark shadows bent on reminding me that i am not well…
sometimes i hear talking from the other rooms, or floors creaking in the upstairs half of my townhouse, town house… such a fancy name for such a shabby dwelling…
the pills help to keep them in line or the fear of them in a bottle…
but still they come when i least expect them…
and still they try to remind me of the doom i have forged for myself these many long years…
(see how i tried to be all Dickensy there?)
my life used to be simple, wake work and on the weekends drink like a fish…
my habits have betrayed me…
and now all i see are ghosts…
"
247,https://www.opendiary.com/m/kermitallica/changes-1200-5488632/,2019-07-24,changes,"
friday is the day i go for surgery…
overnight in the hospital then i get to go home…
have to take a cab because i have become so fucked up that no one wants to hang with me anymore…
i brought it on myself…
and i am okay with it…
my horrible little hurricane inside my head is not distracted by the painful interactions with actual people…
i prefer my friends here…
you’re kind people…
"
248,https://www.opendiary.com/m/kermitallica/blue-morning-blue-day-2-5488730/,2019-07-25,blue morning blue day,"
my next few posts will be of a fiction i am trying to write…
be brutal…
"
