,URL,Creation Time,Title,Content
377,https://www.opendiary.com/m/kermitallica/part-3-173-5575503/,2020-02-03,part 3,"
I remember how he looked when he saw my eyes open. He was a weathered old man, with a stern look on his face. He had seen more of life than he should have, but there was great strength in his heart. That meant nothing when he looked at me with tear stained eyes, and told me I was fine, and wouldn’t be going anywhere.
“Listen to me!” her voice rang inside my head as the world began to blend into a mesh of colors.
“We will meet again. You have a mission here. But first you must find me out there before you can understand.”
I began to cry. I could feel that connection to my love fading, and her song becoming part of the background noise of life. I was once again becoming what I had always been. I felt robbed, violated. This world took my love from me, and I wanted more than life for it to give her back to me.
“What’s the matter little guy?” He asked trying to calm me.
“I didn’t want to come back.” I sobbed.
“Why?” He asked trying to hide his confusion.
“I’m alone here. She can’t come with me.” I sniffed.
“Who?”  He asked again.
I told him of the Lands of the Imagi, and my beloved Elusive. I told him of our time together and what she had shown me, and how much I desperately loved her, and needed to go back.
“Sounds to me like you found a real angel.” He smiled. “But you shouldn’t be sad, because she will be with you your whole life.”
“Is my dad here?” I asked sheepishly.
“No, he had to stay with the rest of the kids.”
“And my mom?” I sighed.
“She’s in the cafeteria. You want me to go get her?”
“No.” I said. “I just want to go to sleep. Would you stay for a little bit?”
“Sure.” He smiled and rubbed my head. The he pulled a chair to the side of my bed, and sat watching me.
“Thank you.” I said. “For saving me.”
“Sure.” He repeated with a sigh of relief.
I rolled over to face him, and asked if the snow had stopped falling, and if I was going to be in trouble for missing school.
“You’re not going to be in trouble for anything.” He said. “You gave us all a scare there though. You were pretty sick, and the doctors had to keep an eye on you for two whole days.”
“Two days?” I asked in shock. “I was gone for two days?”
“Don’t you worry about all that.” He said. “It’s all o.k.”
I closed my eyes, and tried to see her face. I had spent two days with her in the blink of an eye, and I could not remember her face. Then there was a whisper in my mind. The soft refrain of my loves song, and I fell softly to sleep. I didn’t get back to Elusive that night, but I did sleep, soundly, and without fear, in a clean bed, and a warm room.
I woke to find my father standing over my bed. I jumped and covered my face out of pure instinct. The only time he stood over me like that was when I had done something wrong, and I discovered very quickly that if I covered my face, it wouldn’t hurt so badly.
“I’m sorry! I didn’t mean to do it!” I shouted. It was the only thing I knew to say. It rarely helped, but again it was pure reaction.
“Slow down big guy.” The doctor on the other side of my bed said. “He’s been here all night long waiting for you to wake up.”
I looked around the room to see my father, and the doctor standing by my bed, and my mother glaring at me in a chair in the corner of my room. Hoppy had left in the night, to his duties, leaving me alone with them. It would have been nice if he had stayed until I woke.
I had no idea how to be for them. As much as I feared they would ask about my conversation with the sheriff, I felt utterly alone when they left.
I acted for them, and the doctors. I acted like I cared for my parents and nothing at home was wrong, for the doctors. And for my parent’s I acted like I was sicker than I was so they wouldn’t take anything I might have said very seriously.
It was all a huge game with them. Who was more believable? Who could say all the right things? How long was this going to go on?
One day the doctors brought in an old woman who coughed a lot. Her machine would beep all the time and a nurse would come in and make it stop, tuck me back in bed, and close the door quietly.
I wondered who the lady was, and if she had been to the Lands of the Imagi as well, but she was far too sick to speak. All she did was lie in her bed, and stare at the ceiling.
The night before I was to leave, she woke me talking to someone. I couldn’t tell who it was, because there was a curtain between her and I. But she was talking, and trying to convince her friend that she needed more time for something.
“…I remember. But you said I would have a long life…I don’t feel like it’s been a long life…Yes, I know, but all I want is one more day. My son Marty will be here tomorrow, I just want to say goodbye.”
I got out of bed to peak through the curtain to see whom she was talking to. I tip toed over to the divider mostly because I didn’t want to get into trouble for being up so late, and spying. Slowly I pulled the curtain back just enough to see with one eye, the events unfolding in her side of the room.
There setting on her bed was a gorilla in a tuxedo. It was talking perfect English, and smoking a pipe.
“You told Bali that if she gave you a long life, you would go willingly at the time she chose. And she chooses now.” He said puffing on his pipe.
“But my son…” She started to say, when the creature stood over her growling.
“Are you trying to break the deal?” He huffed. “Bali wouldn’t like that very much.”
I saw it reach over and lay his hand on her chest. She immediately began to shake. Her body went stiff, and her face looked like she was being shocked. Her eyes closed tightly and opened abruptly to look me right in the face.
“Don’t look child.” She choked. “Don’t let the beast know you.”
The apelike thing turned its head to face me. Its features were decayed, and dusty. Raw muscle and bone were exposed, but they were dry, and little dust like flakes fell from its face.
“Who might you be?” It smiled and a lump of its cheek fell off.
I jumped to my bed and buried myself in my blankets. The woman’s machine began to beep wildly and soon it became a single ear-piercing whistle. I heard her gurgle something about Bali, and then there was only that whistle.
I felt the blankets being tugged on. It was trying to find a way in. it wanted to hurt me now, like it had the old woman. The tugging became a pulling. I could hear the beast laughing in delight. I pulled them closer to me, and hugged them for dear life.
Suddenly the blanket ripped away from me, I lay staring at the thing. Its teeth shone like white daggers in the half-light. It jumped on my bed standing over me like a great hunter closing in on its prey.
“What does it fear?” It smiled, and crouched over me.
“Ooh.” It smiled in delight.
“Look what you’ve done now!” It snarled in my mother’s voice. “Just wait till your father gets home. When he finds out what you’ve done, he’ll whip the hell out of you!”
It reached out to touch my cheek. I couldn’t move, couldn’t speak or breathe. All I could do was lay there and watch, as this great thing was about to touch me with its shocking grasp. I was almost certain this was the end.
“Elusive.” I whispered just before it touched me. The beast reared back in pain howling as the lights went on in the room. It exploded in a cloud of dust, just before the doctors and nurses burst into the room.
I screamed. I screamed wildly, hysterically venting the sheer terror that had been forced upon me. I thought I might never stop screaming if not for the feint feeling of being held.
My eyes focused on a nurse that had picked me up out of my bed, and was taking me out of my room. She had golden hair, and a soft voice. Her eyes were blue, like Coah’s lake.
Slowly her words began to fill my mind, calming the maelstrom of fright that raged in my mind, and the screaming faded. This nurse, that looked so much like my love saved me from Bali’s beast. It had to be. Elusive had come to my world, to save me.
She sat with me in her arms rocking back and forth, trying in all her ways to calm me, but she hadn’t seen the freakish monster I had just seen. She had not seen what it could do to people.
“Is the monster gone?” I asked shivering in fear.
“What monster?” She asked.
“Bali’s beast.” I whispered. I didn’t want it to hear me call its name.
“How do you know about Bali?”
“I heard the old woman talking to the monkey about it.”
“What monkey?” She asked.
“The one who was in the room.” I said clinging to the nurse. “It said she had to keep the deal, but she wanted to wait and say goodbye to her son tomorrow. That was when it touched her, and her machine went all nuts.”
“Is that why you were screaming?” She sounded concerned.
“No.” I said in fear. “It came after me. It wanted to hurt me.”
From the room I could hear doctors saying things like, “clear”, and “charging”. But soon the room began to fall silent. Then there was a silence that seemed to last forever, and one of the doctors said, “Call it.”
“Time of death,” Another voice spoke. “23:37.”
I stared at the nurse with knowledge in my eyes, the pure fright at knowing that the beast had killed the woman, and was coming to do the same thing to me.
“It wanted to kill me too.” I whispered.
“No.” the nurse said hugging me and rocking again.
“No one wants to kill you.”
“Bali’s beast did.” I said.
“And so does my dad. But that’s a secret between us, OK? You look like Elusive, I can trust you.”
A doctor came out of the room and looked at the nurse rocking me in her arms. She looked at him with tears in her eyes. I looked at him with fear in mine. He stared at us both in confusion, and sadness.
“Doctor,” her voice shook.
“I think we’re going to need a sedative here. The poor things scared to death.”
"
378,https://www.opendiary.com/m/kermitallica/part-4-23-5575617/,2020-02-05,part 4,"
That night I dreamed of my grandmother. We were setting in a rocking chair she sat in when we came to visit. She was rocking me back and forth and singing the song “Amazing Grace.”  We were flying over the Kentucky mountains of her home, and the sun was shining warm and bright, and just for a fleeting moment I thought I heard Coah’s song.
The snow was piled high the day I left the hospital.  In some places it was so high it blotted out the sun. The storm had dropped twenty-two inched of snow on the first day, and six more the following two. Those of us, who remember it, call it “The Blizzard of ’78”.
The streets of my hometown were filled with flashing lights of ambulances, police cars, and fire trucks. Power lines were still being connected as my parents and I slowly rolled through the town. Storefronts and houses could be seen behind mammoth walls of snow, and only little gateway paths shoveled by homeowners and intrepid children looking to make a buck.
Still weak from the fever, my father carried me into the house, and laid me on the couch. He tended to me like a father who loved his child would, and I felt for a moment, that Bali’s Beast had shown me only lies to fill me with fear.
I had lain in the hospital for a week and in all that time I began to see a gentle fear in my father’s continence. I realize only now, that my illness must have shaken him to his core. To lose two sons would have been more than he could take.
Even now in the confines of his home, he handled me with hands that were not his own. They were soft and kind. It was as if he was afraid to touch me, but I felt safe in his grasp and didn’t care to look any further than that.
He had three small boxes’ he brought to me, and told me that it was so I might get better faster. I opened the first, and there was a book, “Ferdinand the Bull”.
I often wonder why it is that a child’s mind remembers such things. It was a good book, about a bull that wanted to be a poet, and not fight in the bullfights, so he spent his days reading under the shade of a tree. I can’t remember how the story ends though.
The second box was filled with a model ship. It was the aircraft carrier, Enterprise. My father knew of my love for ships, and he thought that if he was going to watch me read, he might put a boat together for me. I know now that the kit was for him, but it was something at the time, we did together.
The third box was because I didn’t die. Children have one thing that means the world to them. For some it’s a baseball card, for others it’s a doll, or a race car, or the time they spend with their parents. My miracle in a box was a “Tony the Tiger” monorail. It ran off a “D” cell battery, and poorly. The thing had a figure eight track, and the special thing about the whole mess was that it glowed in the dark.
There in an old cigar box wrapped in newspaper was my toy of toys. It was intended to be a Christmas present, but since I had come so close to loosing my life, my father felt it would be better served as a get well soon gift.
I only touched my father three times in his life. The last time was when I shook his hand and told him to have a good life, it was also the last time I ever saw him. It was the day he told me to love my mother, or leave his house, so I left.
The second time was when I hit him. I had had enough of the pain, and hit him back. It was the only time I ever hit him, because with that one act of defiance, he threw me out of his house, and I learned hard, how to be a man.
This was the first. I hugged him with all the strength I had. I put into that hug, all the love I had. He had finally seen me. He heard me, and knew what I liked and wanted, and he acted on that. I never loved my father more than on that day.
He sat on the floor beside me, and put the train together. He applied the decals and assembled the track. He put the battery in and switched it on, and there in my living room was the bullet train from Tokyo to Andrews!
The thing was flimsy plastic and fell off the track from time to time, but for an hour, my father and I played together. For an hour my life was what I had always hoped for.
It had taken another week for me to get strong enough to move about. I was still not allowed outside, for fear the fever would return, so I spent my time reading my book or playing with my train.
I found that by simply staying out of the way, I was sort of invisible. It was good to live like a kid would live and not fear what would happen if I were in his way during one of his foul moods. That would not last long. You see I am a man of constant motion, if not physically then mentally and in my youth it was an even split.
In each boys life there comes a time when he must achieve that which is unthinkable. For me, it was a fascination with flying. I was determined to achieve escape velocity! I discovered this need through the broadcast of Star Trek, Space 1999 and other fine science fiction shows. I was driven to discover the secrets of weightlessness and the hidden dangers of space. And so I sat myself to ponder the task.
To render ones self weightless, one must first break the aerodynamics’ barrier, to do this one must go real fast. Speed necessitates wheels. More wheels, more speed, hence the theory of velocity.
You also need to go as fast as you can, while spending very little energy, and since things fall down much faster than up, you need a hill. It was shown to me through the film, “When World’s Collide”, that if you add acceleration to a down hill lie escape velocity is not only attainable but inevitable.
In my time as a youth I was able to spend vast quantities of time pondering, investigating and executing hypotheses so to find these ingredients easily took nearly an entire summer. You see we lived on a hill, so step one was a given, however the accelerant to conquer altitude was a problem. As far as I knew there were no rocket engine stores in my town, nor in the county seat and acquiring this very thing was becoming an unsolvable problem, and it was not until the day of July 4th that the answer was revealed to me.
As we always had my family packed themselves into the car and drove to the county seat for the fireworks festival as dusk. It was, as all who enjoy such spectacles, a triumph of explosives and I was spellbound. I asked my father how they did such things, and his answer was contrived at best, he really didn’t know and didn’t want to be bothered with my questions.
I pestered him long enough to get the truth out of him and it was a rare gift. The secret behind those blooming diamond of red, gold and green was gunpowder. It seemed that if you packed gunpowder into tubes and lit a fuse, it would send small rockets into the air where they would then mix with the clouds and explode in triumphant daisies of light and sound.
My mind locked on one thing, “tubes packed with gunpowder would launch small rockets”. My dilemma was now unraveled. Finding gunpowder in my town was easy, after all most of the men who lived there were hunters and if a bullet didn’t fire the first time it was cast aside on the ground and forgotten. There were bullets lying all over the town, if you knew where to look, and I did.
Five weeks of searching, poking around the small creak bed on the edge of town and sifting through the rocks of the train tracks that cut the town in half was all it took. And as I was tasked with the chore of taking out the trash, I would hide all of the paper towel and toilet paper tubes I could find until my needs were satisfied, then it was time to get to work.
My attention span was that of any child’s, however if my need was greater than my span there would be no stopping the task and so it was with this. I would spend most of my day hiding behind the garage tearing bullets apart and dumping the gunpowder into the tubes.
I taped one end closed to keep the fuel inside and filled about five of them with the precious black explosive. I taped the other end shut once they were full and using bits of fuse scrounged up from the independence day festivals I was nearing the realization of a dream.
It was late September when the tools and the talent came hand in hand. I told all my friends of the endeavor I was about to attempt and everyone showed. I has set up a small ramp at the foot of the hill where the train tracks I would delight in trying to beat oncoming loco-motives every chance I got lay in wait. I then taped the engines to the back of my bicycle seat and sat there staring at the foot of the hill, this would be my moment. This would be the place where a small boy would join the ranks of those who had gone so boldly before.
Handing the lighter I had stolen from my father, to my best friend, I nodded and readied myself for pre-flight. The young man, who will remain nameless even after all these years, lit the fuses and a great cry went up through the small crowd.
My feet pounded on the pedals of my bicycle and we lurched off down the hill. As I picked up speed, I lost sound. The excitement of my experiment had weighed heavily on me and in the execution all I could hear was the sound of my breath in my ears and a strange sort of imaginary inner sound track to my voyage.
I looked left as I passed my house to see my father stepping out of the doorway waving at me. His excitement was as great as mine for as I zoomed past him it seemed, he was waving frantically and cheering me on.
Everything in the world faded away as my front tire hit the ramp. The world melted into nothing as I felt the bike sour into the air. There was a muffled thump behind me and I knew the engines had fired, this was my moment…or so I thought.
You see I wanted the engines to be a powerful as possible, so I packed as much gunpowder into them as I could. No one had taken the time to fully explain to me the dynamics, of dynamite and it was plain to all who saw, that I had stumbled across this formula on my own.
When the engines blew, they tore off the rear end of my bike, my seat and threw me from the vehicle like a man swatting a fly. It was in mid “jump” that I was pushed forward and thrown clear of the wreckage, unfortunately for me, there was till the second half of my flight, where I discovered the truth of gravity. What goes up, will come down.
I landed flatly, hard and unceremoniously on my back. I bounced only once and slid for a long time. This was no the end of my plight. You see I had beaten by bike to the ground and what little was left of it, was hot on my heals and determined to catch up to me.
With a powerful vengeance my bike shards crashed into me, this brought about the return of sound which was a shocking realization that, there was something wrong. I felt no pain, but my focus, my che, if you will was a broken as my dream and when a dream dies, reality must set in.
The reality was my rockets had actually exploded, ejected me from my bike and sent shards of the poor thing flying in all directions, most of which were blocked by me. The fireball of the explosion also set my pants and shirt on fire. This didn’t last too long with my re-acquaintance with mother earth. It was not so much the stop drop and roll I was taught in school, but I was told that the three basic elements of the theory were in play.
With reality now firmly in hand, I could feel the first tingle of the pain I was about to suffer and instinct took over. The once great and powerful man who stood victorious at the top of the hill was now nothing more than a whimpering child.
I wanted to get to my feet. It is known that if you can stand after a trauma then you will survive said trauma. I could not stand, hopelessly tangled in the wreckage of my bike and peppered with bits of it in my legs, I was powerless to stand. The tears and panic grew greater and greater as I lay in the fading light of one late summer dusk, waiting for help, if any, to arrive.
And so it did, in the form of my father, who had rushed to me without my knowledge and flung the bits and pieces of my dream aside to rescue me from my failure. He walked with me in his arms, to the car and we drove faster than any time I had ever known to the hospital in the county seat, one more time.
He stayed with me as long as the doctors would allow, but eventually I was alone in their care. I can only wonder what he did, or how he felt as we were separated, and time had taught me that he was not at all fearful of my condition. However, for a frightened little boy who was rescued from certain doom by the hands of his father, all was right in the world.
I became a fan of sedatives at a very early age. Sedatives take the pain away. I liked not having any pain. I was also told that in my sedated state, I was quite the little funny bone. I could chatter on for hours and keep most entertained.
Yet with every good thing about drugs there is a dark side. You see not only would I chatter on, but I would not know when to quit and secrets would be spilled. Things that should not have been said were known and this was always a bad thing.
"
